### ISSUE TITLE
[Bug]: TUN模式下默认只会从1.0.0.1解析域名，而忽略DNS的配置，貌似dns-hijack没有起作用

### ISSUE THREAD

**Issue by tony1016** [Fndroid/clash_for_windows_pkg#3577]
### 请认真检查以下清单中的每一项

- [X] 已经搜索过，没有发现类似issue
- [x] 已经搜索过文档，没有发现相关内容
- [x] 已经尝试使用过最新版，问题依旧存在
- [x] 使用的是官方版本（未替换及修改过安装目录程序文件）

### 软件版本

0.20.5

### 操作系统

Linux

### 系统版本

Manjaro

### 问题描述

因为机场为了避免海外连接，从海外解析IP时，会解析到1.2.3.4的一个黑洞IP上，从而防止海外链接。我发现CFW在TUN模式开启后，服务器地址解析都走的1.0.0.1,导致服务器无法连接。

### 复现步骤

在界面开启TUN。

### 日志文件

<details><summary>logs</summary><p>

```
进入Home Directory/logs文件夹，找到日志文件，将文件拖动至输入框或点击界面左下角小字，将打开文件内容粘贴替换这行
```

</p></details>

### 其他补充

即使用MIXIN自己建DNS，通过tcpdump跟踪，发现也仅请求1.0.0.1

**Comment by yi-Xu-0100** [comment]
那就是用 tun 就好，或者使用 nameserver-policy

**Comment by tony1016** [comment]
补充一下，感觉哪里不对，我用tcpdump拦截了请求包，无论我是从界面上打开TUN还是用MIXIN打开TUN，都会从1.1.1.1请求域名

19:44:38.581206 IP tony-gk41.36507 > one.one.one.one.domain: 15828+ A? v.qq.com. (26)
19:44:38.581210 IP tony-gk41.58462 > one.one.one.one.domain: 15828+ A? v.qq.com. (26)
19:44:38.581374 IP tony-gk41.43017 > one.one.one.one.domain: 15828+ A? v.qq.com. (26)

**Comment by tony1016** [comment]
明白了，hijack没有起作用
19:52:22.282660 IP 192.168.31.165.57138 > 1.0.0.1.53: 1500+ A? www.bilibili.com. (34)
19:52:22.282665 IP 192.168.31.165.51356 > 1.0.0.1.53: 1500+ A? www.bilibili.com. (34)
19:52:22.282666 IP 192.168.31.165.39165 > 1.0.0.1.53: 1500+ A? www.bilibili.com. (34)

**Comment by tony1016** [comment]
我在一台0.19.29的机器上作了测试，结果完全不一样

09:48:37.578642 IP 172.31.82.178.33691 > 223.5.5.5.53: 20148+ A? www.bilibili.com. (34)
09:48:37.581155 IP 172.31.82.178.57458 > 8.8.8.8.53: 20148+ A? www.bilibili.com. (34)
09:48:37.581167 IP 172.31.82.178.43090 > 114.114.114.114.53: 20148+ A? www.bilibili.com. (34)

**Comment by Fndroid** [comment]
This issue is stale because it has been open 60 days with no activity. Remove stale label or comment or this will be closed in 7 days
